title,type,agency_names,abstract,citation,document_number,html_url,pdf_url,publication_date
"Protection of Stratospheric Ozone: Listing of Substitutes Under the Significant New Alternatives Policy Program in Refrigeration, Air Conditioning, and Fire Suppression",Rule,Environmental Protection Agency,"Pursuant to the U.S. Environmental Protection Agency's Significant New Alternatives Policy program, this action lists certain substances as acceptable, subject to use conditions, in the refrigeration and air conditioning sector for chillers--comfort cooling, residential dehumidifiers, residential and light commercial air conditioning and heat pumps, and a substance as acceptable, subject to use conditions and narrowed use limits, in very low temperature refrigeration. Through this action, EPA is incorporating by reference standards which establish requirements for electrical air conditioners, heat pumps, and dehumidifiers, laboratory equipment containing refrigerant, safe use of flammable refrigerants, and safe design, construction, installation, and operation of refrigeration systems. Finally, this action lists certain substances as acceptable, subject to use conditions, in the fire suppression sector for certain streaming and total flooding uses.",88 FR 26382, 2023-08663,https://www.federalregister.gov/documents/2023/04/28/2023-08663/protection-of-stratospheric-ozone-listing-of-substitutes-under-the-significant-new-alternatives,https://www.govinfo.gov/content/pkg/FR-2023-04-28/pdf/2023-08663.pdf,04/28/2023
Clean Water Act Section 404 Tribal and State Assumption Program,Rule,Environmental Protection Agency,"The Environmental Protection Agency (EPA or the Agency) is finalizing the Agency's first comprehensive revisions to the regulations governing Clean Water Act (CWA) section 404 Tribal and State programs since 1988. The primary purpose of the revisions is to respond to longstanding requests from Tribes and States to clarify the requirements and processes for the assumption and administration of a CWA section 404 permitting program for discharges of dredged and fill material. The revisions facilitate Tribal and State assumption and administration of CWA section 404, consistent with the policy of the CWA as described in section 101(b), by making the procedures and substantive requirements for assumption transparent and straightforward. It clarifies the minimum requirements for Tribal and State programs while ensuring flexibility to accommodate individual Tribal and State needs. In addition, the final rule clarifies the criminal negligence standard in the CWA section 404 program, as well as making a corresponding change in the section 402 program. Finally, the final rule makes technical revisions, including removing outdated references associated with the section 404 Tribal and State program regulations.",89 FR 103454, 2024-29484,https://www.federalregister.gov/documents/2024/12/18/2024-29484/clean-water-act-section-404-tribal-and-state-assumption-program,https://www.govinfo.gov/content/pkg/FR-2024-12-18/pdf/2024-29484.pdf,12/18/2024
Finding That Greenhouse Gas Emissions From Aircraft Cause or Contribute to Air Pollution That May Reasonably Be Anticipated To Endanger Public Health and Welfare,Rule,Environmental Protection Agency,"In this action, the Administrator finds that elevated concentrations of greenhouse gases in the atmosphere endanger the public health and welfare of current and future generations within the meaning of section 231(a)(2)(A) of the Clean Air Act (CAA, or Act). She makes this finding specifically with respect to the same six well-mixed greenhouse gases--carbon dioxide (CO<INF>2</INF>), methane, nitrous oxide, hydrofluorocarbons, perfluorocarbons, and sulfur hexafluoride-- that together were defined as the air pollution in the 2009 Endangerment Finding under section 202(a) of the CAA and that together constitute the primary cause of the climate change problem. The Administrator also finds that emissions of those six well-mixed greenhouse gases from certain classes of engines used in certain aircraft are contributing to the air pollution--the aggregate group of the same six greenhouse gases--that endangers public health and welfare under CAA section 231(a)(2)(A).",81 FR 54422, 2016-18399,https://www.federalregister.gov/documents/2016/08/15/2016-18399/finding-that-greenhouse-gas-emissions-from-aircraft-cause-or-contribute-to-air-pollution-that-may,https://www.govinfo.gov/content/pkg/FR-2016-08-15/pdf/2016-18399.pdf,08/15/2016
Protection of Stratospheric Ozone: Listing of Substitutes Under the Significant New Alternatives Policy Program,Rule,Environmental Protection Agency,"Pursuant to the U.S. Environmental Protection Agency's (EPA) Significant New Alternatives Policy program, this action lists certain substances in the refrigeration and air conditioning sector. For the retail food refrigeration--medium-temperature stand-alone units (new) end-use, EPA is listing three substitutes as acceptable subject to narrowed use limits. For the residential and light commercial air conditioning and heat pumps (new) end-use, EPA is listing six substitutes as acceptable subject to use conditions. Through this action, EPA is incorporating by reference the 2019 Underwriters Laboratories (UL) Standard 60335-2-40, 3rd Edition, which establishes requirements for the evaluation of electrical air conditioners, heat pumps, and dehumidifiers, and safe use of flammable refrigerants. This action also removes an acceptable subject to use conditions listing for the fire suppression sector because EPA more recently listed the substitute as acceptable with no use restrictions.",86 FR 24444, 2021-08968,https://www.federalregister.gov/documents/2021/05/06/2021-08968/protection-of-stratospheric-ozone-listing-of-substitutes-under-the-significant-new-alternatives,https://www.govinfo.gov/content/pkg/FR-2021-05-06/pdf/2021-08968.pdf,05/06/2021
"Oil Pollution Prevention; Spill Prevention, Control, and Countermeasure (SPCC) Rule-Compliance Date Amendment for Farms",Rule,Environmental Protection Agency,"EPA (or the Agency) is taking final action to amend the date by which farms must prepare or amend, and implement their Spill Prevention, Control, and Countermeasure Plans to May 10, 2013. The date is being amended because a large segment of the continental U.S. was affected by flooding during the spring and summer of 2011, and other areas were impacted by devastating fires and drought conditions. In addition, despite the targeted farm outreach efforts by EPA over the past ten months, the sheer number of farms throughout the U.S. makes it a challenge to reach those owners and operators of farms that may be subject to the SPCC Plan regulations. As a result, the Agency believes that farms need additional time to come into compliance with the requirements to prepare or amend and implement a SPCC Plan.",76 FR 72120, 2011-29901,https://www.federalregister.gov/documents/2011/11/22/2011-29901/oil-pollution-prevention-spill-prevention-control-and-countermeasure-spcc-rule-compliance-date,https://www.govinfo.gov/content/pkg/FR-2011-11-22/pdf/2011-29901.pdf,11/22/2011
Emission Guidelines and Compliance Times for Municipal Solid Waste Landfills,Rule,Environmental Protection Agency,"The Environmental Protection Agency (EPA) is finalizing a new subpart that updates the Emission Guidelines and Compliance Times for Municipal Solid Waste Landfills (Emission Guidelines). The EPA reviewed the landfills Emission Guidelines based on changes in the landfills industry since the Emission Guidelines were promulgated in 1996. The EPA's review of the Emission Guidelines for municipal solid waste (MSW) landfills considered landfills that accepted waste after November 8, 1987, and commenced construction, reconstruction, or modification on or before July 17, 2014. Based on this review, the EPA has determined that it is appropriate to revise the Emission Guidelines to reflect changes to the population of landfills and the results of an analysis of the timing and methods for reducing emissions. This action will achieve additional reductions in emissions of landfill gas and its components, including methane, by lowering the emissions threshold at which a landfill must install controls. This action also incorporates new data and information received in response to an advanced notice of proposed rulemaking and a proposed rulemaking and addresses other regulatory issues including surface emissions monitoring, wellhead monitoring, and the definition of landfill gas treatment system. The revised Emission Guidelines, once implemented through revised state plans or a revised federal plan, will reduce emissions of landfill gas, which contains both nonmethane organic compounds and methane. Landfills are a significant source of methane, which is a potent greenhouse gas pollutant. These avoided emissions will improve air quality and reduce the potential for public health and welfare effects associated with exposure to landfill gas emissions.",81 FR 59276, 2016-17700,https://www.federalregister.gov/documents/2016/08/29/2016-17700/emission-guidelines-and-compliance-times-for-municipal-solid-waste-landfills,https://www.govinfo.gov/content/pkg/FR-2016-08-29/pdf/2016-17700.pdf,08/29/2016
Revised 2023 and Later Model Year Light-Duty Vehicle Greenhouse Gas Emissions Standards,Rule,Environmental Protection Agency,"The Environmental Protection Agency (EPA) is revising the greenhouse gas (GHG) emissions standards under the Clean Air Act section 202(a) for light-duty vehicles for 2023 and later model years to make the standards more stringent. On January 20, 2021, President Biden issued Executive Order 13990 ""Protecting Public Health and the Environment and Restoring Science To Tackle the Climate Crisis"" directing EPA to consider whether to propose suspending, revising, or rescinding the standards previously revised under the ""The Safer Affordable Fuel-Efficient (SAFE) Vehicles Rule for Model Years 2021- 2026 Passenger Cars and Light Trucks,"" promulgated in April 2020. EPA is revising the GHG standards to be more stringent than the SAFE rule standards in each model year from 2023 through 2026. EPA is also including temporary targeted flexibilities to address the lead time of the final standards and to incentivize the production of vehicles with zero and near-zero emissions technology. In addition, EPA is making technical amendments to clarify and streamline our regulations.",86 FR 74434, 2021-27854,https://www.federalregister.gov/documents/2021/12/30/2021-27854/revised-2023-and-later-model-year-light-duty-vehicle-greenhouse-gas-emissions-standards,https://www.govinfo.gov/content/pkg/FR-2021-12-30/pdf/2021-27854.pdf,12/30/2021
Credit Assistance for Water Infrastructure Projects,Rule,Environmental Protection Agency,"The Environmental Protection Agency (EPA) is issuing an interim final rule to implement a new program authorized under Subtitle C of the Water Resources Reform and Development Act of 2014 (WRRDA), which is referred to as the Water Infrastructure Finance and Innovation Act of 2014 (WIFIA). WIFIA authorizes EPA to provide secured (direct) loans and loan guarantees to eligible water infrastructure projects. Projects will be evaluated and selected by the Administrator of the EPA based on criteria set out in this rule using weightings established in a separate Notice of Funding Availability (NOFA). Following project selection, individual credit agreements will be developed through negotiations between the project sponsors and EPA. EPA is soliciting comments on an interim final rule that establishes the guidelines for the new credit assistance program for water and infrastructure projects and the process by which EPA will administer such credit assistance. The interim final rule primarily restates and clarifies statutory language while establishing approaches to specific procedural issues left to EPA's discretion. This interim final rule pertains to a matter involving a federal loan and loan guarantee program and is therefore exempt from the rulemaking requirements of the Administrative Procedure Act. As such, EPA is issuing this rule as interim final.",81 FR 91822, 2016-30194,https://www.federalregister.gov/documents/2016/12/19/2016-30194/credit-assistance-for-water-infrastructure-projects,https://www.govinfo.gov/content/pkg/FR-2016-12-19/pdf/2016-30194.pdf,12/19/2016
Clean Water Act Hazardous Substance Facility Response Plans,Rule,Environmental Protection Agency,"The U.S. Environmental Protection Agency (EPA or Agency) is finalizing facility response plan requirements for worst case discharges of Clean Water Act (CWA) hazardous substances for onshore non-transportation-related facilities that could reasonably be expected to cause substantial harm to the environment by discharging a CWA hazardous substance into or on the navigable waters, adjoining shorelines, or exclusive economic zone.",89 FR 21924, 2024-05870,https://www.federalregister.gov/documents/2024/03/28/2024-05870/clean-water-act-hazardous-substance-facility-response-plans,https://www.govinfo.gov/content/pkg/FR-2024-03-28/pdf/2024-05870.pdf,03/28/2024
Standards of Performance for Municipal Solid Waste Landfills,Rule,Environmental Protection Agency,"The Environmental Protection Agency (EPA) is finalizing a new subpart that updates the Standards of Performance for Municipal Solid Waste Landfills. Under section 111 of the Clean Air Act, the EPA must review, and, if appropriate, revise standards of performance at least every 8 years. The EPA's review of the standards for municipal solid waste landfills considered landfills that commence construction, reconstruction, or modification after July 17, 2014. The final standards also reflect changes to the population of landfills and an analysis of the timing and methods for reducing emissions. This action will achieve additional reductions in emissions of landfill gas and its components, including methane, by lowering the emissions threshold at which a landfill must install controls. This action also incorporates new data and information received in response to the proposed rulemaking and addresses other regulatory issues including surface emissions monitoring, wellhead monitoring, and the definition of landfill gas treatment system. The new subpart will reduce emissions of landfill gas, which contains both nonmethane organic compounds and methane. Landfills are a significant source of methane, which is a potent greenhouse gas pollutant. These avoided emissions will improve air quality and reduce the potential for public health and welfare effects associated with exposure to landfill gas emissions.",81 FR 59332, 2016-17687,https://www.federalregister.gov/documents/2016/08/29/2016-17687/standards-of-performance-for-municipal-solid-waste-landfills,https://www.govinfo.gov/content/pkg/FR-2016-08-29/pdf/2016-17687.pdf,08/29/2016
Notice of Funding Availability for Credit Assistance Under WIFIA Program,Notice,Environmental Protection Agency,"In the Further Consolidated Appropriations Act, 2022, signed by the President on March 15, 2022, Congress provided $58.5 million in budget authority for the Water Infrastructure Finance and Innovation Act of 2014 (WIFIA) program to cover the subsidy required to provide a much larger amount of credit assistance. The U.S. Environmental Protection Agency (EPA) estimates that this budget authority may provide approximately $5.5 billion in credit assistance and may finance approximately $11 billion in water infrastructure investment. The purpose of this notice of funding availability (NOFA) is to solicit letters of interest (LOIs) from prospective borrowers seeking credit assistance from EPA under the WIFIA program.",87 FR 36489, 2022-12987,https://www.federalregister.gov/documents/2022/06/17/2022-12987/notice-of-funding-availability-for-credit-assistance-under-wifia-program,https://www.govinfo.gov/content/pkg/FR-2022-06-17/pdf/2022-12987.pdf,06/17/2022
Carbon Pollution Emission Guidelines for Existing Stationary Sources: Electric Utility Generating Units,Rule,Environmental Protection Agency,"In this action, the Environmental Protection Agency (EPA) is establishing final emission guidelines for states to follow in developing plans to reduce greenhouse gas (GHG) emissions from existing fossil fuel-fired electric generating units (EGUs). Specifically, the EPA is establishing: Carbon dioxide (CO<INF>2</INF>) emission performance rates representing the best system of emission reduction (BSER) for two subcategories of existing fossil fuel-fired EGUs--fossil fuel-fired electric utility steam generating units and stationary combustion turbines; state-specific CO<INF>2</INF> goals reflecting the CO<INF>2</INF> emission performance rates; and guidelines for the development, submittal and implementation of state plans that establish emission standards or other measures to implement the CO<INF>2</INF> emission performance rates, which may be accomplished by meeting the state goals. This final rule will continue progress already underway in the U.S. to reduce CO<INF>2</INF> emissions from the utility power sector.",80 FR 64662, 2015-22842,https://www.federalregister.gov/documents/2015/10/23/2015-22842/carbon-pollution-emission-guidelines-for-existing-stationary-sources-electric-utility-generating,https://www.govinfo.gov/content/pkg/FR-2015-10-23/pdf/2015-22842.pdf,10/23/2015
Notification of Funding for Credit Assistance Under the Water Infrastructure Finance and Innovation Act (WIFIA) Program,Rule,Environmental Protection Agency,"In the Further Consolidated Appropriations Act, 2021, signed by the President on December 27, 2020, Congress provided $54.5 million in budget authority for the Water Infrastructure Finance and Innovation Act of 2014 (WIFIA) program to cover the subsidy required to provide a much larger amount of credit assistance. The Environmental Protection Agency (EPA or Agency) estimates that this budget authority may provide approximately $5.5 billion in credit assistance and may finance approximately $11 billion in water infrastructure investment. The purpose of this NOFA is to solicit letters of interest (LOIs) from prospective borrowers seeking credit assistance from EPA. EPA will evaluate and select proposed projects described in the LOIs using the selection criteria established in statute and regulation, and further described in this NOFA as well as the WIFIA program handbook. This NOFA establishes relative weights that will be used in the current LOI submittal period for the selection criteria, explains budgetary scoring factors to determine budgetary scoring compliance, and outlines the process that prospective borrowers should follow to be considered for WIFIA credit assistance. In addition, EPA reserves the right to make additional awards using FY 2021 appropriated funding or available carry-over resources, consistent with Agency policy and guidance, if additional funding is available after the original selections are made. This could include holding a subsequent selection round.",86 FR 22612, 2021-08867,https://www.federalregister.gov/documents/2021/04/29/2021-08867/notification-of-funding-for-credit-assistance-under-the-water-infrastructure-finance-and-innovation,https://www.govinfo.gov/content/pkg/FR-2021-04-29/pdf/2021-08867.pdf,04/29/2021
"Standards of Performance for Greenhouse Gas Emissions From New, Modified, and Reconstructed Stationary Sources: Electric Utility Generating Units",Rule,Environmental Protection Agency,"The Environmental Protection Agency (EPA) is finalizing new source performance standards (NSPS) under Clean Air Act (CAA) section 111(b) that, for the first time, will establish standards for emissions of carbon dioxide (CO<INF>2</INF>) for newly constructed, modified, and reconstructed affected fossil fuel-fired electric utility generating units (EGUs). This action establishes separate standards of performance for fossil fuel-fired electric utility steam generating units and fossil fuel-fired stationary combustion turbines. This action also addresses related permitting and reporting issues. In a separate action, under CAA section 111(d), the EPA is issuing final emission guidelines for states to use in developing plans to limit CO<INF>2</INF> emissions from existing fossil fuel-fired EGUs.",80 FR 64510, 2015-22837,https://www.federalregister.gov/documents/2015/10/23/2015-22837/standards-of-performance-for-greenhouse-gas-emissions-from-new-modified-and-reconstructed-stationary,https://www.govinfo.gov/content/pkg/FR-2015-10-23/pdf/2015-22837.pdf,10/23/2015
Protection of Stratospheric Ozone: Listing of Substitutes for Ozone-Depleting Substances-Fire Suppression and Explosion Protection,Rule,Environmental Protection Agency,"EPA is taking direct final action to list substitutes for ozone-depleting substances (ODSs) in the fire suppression and explosion protection sector as acceptable subject to use restrictions under the EPA's Significant New Alternatives Policy program. This program implements Section 612 of the Clean Air Act, as amended in 1990, which requires EPA to evaluate substitutes for ozone-depleting substances and find them acceptable where they pose comparable or lower overall risk to human health and the environment than other available substitutes.",77 FR 58035, 2012-23138,https://www.federalregister.gov/documents/2012/09/19/2012-23138/protection-of-stratospheric-ozone-listing-of-substitutes-for-ozone-depleting-substances-fire,https://www.govinfo.gov/content/pkg/FR-2012-09-19/pdf/2012-23138.pdf,09/19/2012
"New Source Performance Standards for Greenhouse Gas Emissions From New, Modified, and Reconstructed Fossil Fuel-Fired Electric Generating Units; Emission Guidelines for Greenhouse Gas Emissions From Existing Fossil Fuel-Fired Electric Generating Units; and Repeal of the Affordable Clean Energy Rule",Rule,Environmental Protection Agency,"The Environmental Protection Agency (EPA) is finalizing multiple actions under section 111 of the Clean Air Act (CAA) addressing greenhouse gas (GHG) emissions from fossil fuel-fired electric generating units (EGUs). First, the EPA is finalizing the repeal of the Affordable Clean Energy (ACE) Rule. Second, the EPA is finalizing emission guidelines for GHG emissions from existing fossil fuel-fired steam generating EGUs, which include both coal-fired and oil/gas-fired steam generating EGUs. Third, the EPA is finalizing revisions to the New Source Performance Standards (NSPS) for GHG emissions from new and reconstructed fossil fuel-fired stationary combustion turbine EGUs. Fourth, the EPA is finalizing revisions to the NSPS for GHG emissions from fossil fuel-fired steam generating units that undertake a large modification, based upon the 8-year review required by the CAA. The EPA is not finalizing emission guidelines for GHG emissions from existing fossil fuel-fired stationary combustion turbines at this time; instead, the EPA intends to take further action on the proposed emission guidelines at a later date.",89 FR 39798, 2024-09233,https://www.federalregister.gov/documents/2024/05/09/2024-09233/new-source-performance-standards-for-greenhouse-gas-emissions-from-new-modified-and-reconstructed,https://www.govinfo.gov/content/pkg/FR-2024-05-09/pdf/2024-09233.pdf,05/09/2024
National Emission Standards for Hazardous Air Pollutants: Generic Maximum Achievable Control Technology Standards Residual Risk and Technology Review for Ethylene Production,Rule,Environmental Protection Agency,"This action finalizes the residual risk and technology review (RTR) conducted for the Ethylene Production source category regulated under National Emission Standards for Hazardous Air Pollutants (NESHAP). In addition, the U.S. Environmental Protection Agency (EPA) is taking final action to correct and clarify regulatory provisions related to emissions during periods of startup, shutdown, and malfunction (SSM), including removing general exemptions for periods of SSM, adding work practice standards for periods of SSM where appropriate, and clarifying regulatory provisions for certain vent control bypasses. The EPA is also taking final action to revise requirements for heat exchange systems; add monitoring and operational requirements for flares; add provisions for electronic reporting of performance test results and other reports; and include other technical corrections to improve consistency and clarity. We estimate that these final amendments will reduce hazardous air pollutants (HAP) emissions from this source category by 29 tons per year (tpy) and reduce excess emissions of HAP from flares by an additional 1,430 tpy.",85 FR 40386, 2020-05898,https://www.federalregister.gov/documents/2020/07/06/2020-05898/national-emission-standards-for-hazardous-air-pollutants-generic-maximum-achievable-control,https://www.govinfo.gov/content/pkg/FR-2020-07-06/pdf/2020-05898.pdf,07/06/2020
