title,type,agency_names,abstract,citation,document_number,html_url,pdf_url,publication_date
Effluent Limitations Guidelines and Standards for the Oil and Gas Extraction Point Source Category,Rule,Environmental Protection Agency,"The Environmental Protection Agency (EPA) is publishing a final Clean Water Act (CWA) regulation that protects human health, the environment and the operational integrity of publicly owned treatment works (POTWs) by establishing pretreatment standards that prevent the discharge of pollutants in wastewater from onshore unconventional oil and gas (UOG) extraction facilities to POTWs. UOG extraction wastewater can be generated in large quantities and contains constituents that are potentially harmful to human health and the environment. Certain UOG extraction wastewater constituents are not typical of POTW influent wastewater and can be discharged, untreated, from the POTW to the receiving stream; can disrupt the operation of the POTW (e.g., by inhibiting biological treatment); can accumulate in biosolids (sewage sludge), limiting their beneficial use; and can facilitate the formation of harmful disinfection by-products (DBPs). Based on the information collected by EPA, the requirements of this final rule reflect current industry practices for onshore unconventional oil and gas extraction facilities. Therefore, EPA does not project that the final rule will impose any costs or lead to pollutant removals, but will ensure that current industry best practice is maintained over time.",81 FR 41845, 2016-14901,https://www.federalregister.gov/documents/2016/06/28/2016-14901/effluent-limitations-guidelines-and-standards-for-the-oil-and-gas-extraction-point-source-category,https://www.govinfo.gov/content/pkg/FR-2016-06-28/pdf/2016-14901.pdf,06/28/2016
National Emission Standards for Hazardous Air Pollutants: Coal- and Oil-Fired Electric Utility Steam Generating Units Review of the Residual Risk and Technology Review,Rule,Environmental Protection Agency,"This action finalizes amendments to the national emission standards for hazardous air pollutants (NESHAP) for the Coal- and Oil- Fired Electric Utility Steam Generating Units (EGUs) source category. These final amendments are the result of the EPA's review of the 2020 Residual Risk and Technology Review (RTR). The changes, which were proposed under the technology review in April 2023, include amending the filterable particulate matter (fPM) surrogate emission standard for non-mercury metal hazardous air pollutants (HAP) for existing coal- fired EGUs, the fPM emission standard compliance demonstration requirements, and the mercury (Hg) emission standard for lignite-fired EGUs. Additionally, the EPA is finalizing a change to the definition of ""startup."" The EPA did not propose, and is not finalizing, any changes to the 2020 Residual Risk Review.",89 FR 38508, 2024-09148,https://www.federalregister.gov/documents/2024/05/07/2024-09148/national-emission-standards-for-hazardous-air-pollutants-coal--and-oil-fired-electric-utility-steam,https://www.govinfo.gov/content/pkg/FR-2024-05-07/pdf/2024-09148.pdf,05/07/2024
National Emission Standards for Hazardous Air Pollutants: Municipal Solid Waste Landfills Residual Risk and Technology Review,Rule,Environmental Protection Agency,"This action finalizes the residual risk and technology review (RTR) conducted for the Municipal Solid Waste (MSW) Landfills source category regulated under national emission standards for hazardous air pollutants (NESHAP). In addition, we are taking final action to correct and clarify regulatory provisions related to emissions during periods of startup, shutdown, and malfunction (SSM); revise wellhead operational standards and corrective action to improve effectiveness and provide compliance flexibility; reorganize rule text to incorporate provisions from the new source performance standards (NSPS) within this subpart; and add requirements for electronic reporting of performance test results. The EPA is also finalizing minor changes to the MSW Landfills NSPS and Emission Guidelines (EG) and Compliance Times for MSW Landfills. Specifically, the EPA is finalizing provisions to the most recent MSW Landfills NSPS and EG that would allow affected sources to demonstrate compliance with landfill gas control, operating, monitoring, recordkeeping, and reporting requirements by following the corresponding requirements in the MSW Landfills NESHAP. These final amendments will result in improved compliance and implementation of the rule.",85 FR 17244, 2020-04800,https://www.federalregister.gov/documents/2020/03/26/2020-04800/national-emission-standards-for-hazardous-air-pollutants-municipal-solid-waste-landfills-residual,https://www.govinfo.gov/content/pkg/FR-2020-03-26/pdf/2020-04800.pdf,03/26/2020
Draft National Pollutant Discharge Elimination System (NPDES) General Permit for Stormwater Discharges From Construction Activities,Notice,Environmental Protection Agency,"EPA's Regional Offices are proposing for public comment the draft National Pollutant Discharge Elimination System general permit for stormwater discharges from large and small construction activities. This draft construction general permit includes new requirements that implement the technology-based Effluent Limitation Guidelines and New Source Performance Standards, which were issued by EPA for the construction and development industry on December 1, 2009. The draft permit also includes new water quality-based requirements for construction sites discharging stormwater to waters requiring additional pollutant control. EPA proposes to issue this construction general permit for five (5) years, and to provide permit coverage to eligible existing and new construction projects in all areas of the country where EPA is the National Pollutant Discharge Elimination System permitting authority, including Idaho, Massachusetts, New Hampshire, and New Mexico, Indian Country Lands, Puerto Rico, Washington, DC, and U.S. territories and protectorates.",76 FR 22882, 2011-9929,https://www.federalregister.gov/documents/2011/04/25/2011-9929/draft-national-pollutant-discharge-elimination-system-npdes-general-permit-for-stormwater-discharges,https://www.govinfo.gov/content/pkg/FR-2011-04-25/pdf/2011-9929.pdf,04/25/2011
"National Emission Standards for Hazardous Air Pollutants From Coal- and Oil-Fired Electric Utility Steam Generating Units and Standards of Performance for Fossil-Fuel-Fired Electric Utility, Industrial-Commercial-Institutional, and Small Industrial-Commercial-Institutional Steam Generating Units",Rule,Environmental Protection Agency,"On May 3, 2011, under authority of Clean Air Act (CAA) sections 111 and 112, the EPA proposed both national emission standards for hazardous air pollutants (NESHAP) from coal- and oil-fired electric utility steam generating units (EGUs) and standards of performance for fossil-fuel-fired electric utility, industrial-commercial- institutional, and small industrial-commercial-institutional steam generating units (76 FR 24976). After consideration of public comments, the EPA is finalizing these rules in this action. Pursuant to CAA section 111, the EPA is revising standards of performance in response to a voluntary remand of a final rule. Specifically, we are amending new source performance standards (NSPS) after analysis of the public comments we received. We are also finalizing several minor amendments, technical clarifications, and corrections to existing NSPS provisions for fossil fuel-fired EGUs and large and small industrial-commercial-institutional steam generating units. Pursuant to CAA section 112, the EPA is establishing NESHAP that will require coal- and oil-fired EGUs to meet hazardous air pollutant (HAP) standards reflecting the application of the maximum achievable control technology. This rule protects air quality and promotes public health by reducing emissions of the HAP listed in CAA section 112(b)(1).",77 FR 9304, 2012-806,https://www.federalregister.gov/documents/2012/02/16/2012-806/national-emission-standards-for-hazardous-air-pollutants-from-coal--and-oil-fired-electric-utility,https://www.govinfo.gov/content/pkg/FR-2012-02-16/pdf/2012-806.pdf,02/16/2012
National Emission Standards for Hazardous Air Pollutants: Plywood and Composite Wood Products Residual Risk and Technology Review,Rule,Environmental Protection Agency,"This action finalizes the residual risk and technology review (RTR) conducted for the Plywood and Composite Wood Products (PCWP) source category regulated under national emission standards for hazardous air pollutants (NESHAP). In addition, the EPA is taking final action addressing periods of startup, shutdown and malfunction (SSM); adding electronic reporting; adding repeat emissions testing; and making technical and editorial changes. These final amendments include no revisions to the numerical emission limits in the rule based on the RTR. While the amendments do not result in reductions of emissions of hazardous air pollutants (HAP), this action results in improved monitoring, compliance, and implementation of the rule.",85 FR 49434, 2020-12725,https://www.federalregister.gov/documents/2020/08/13/2020-12725/national-emission-standards-for-hazardous-air-pollutants-plywood-and-composite-wood-products,https://www.govinfo.gov/content/pkg/FR-2020-08-13/pdf/2020-12725.pdf,08/13/2020
Standards of Performance for New Stationary Sources and Emission Guidelines for Existing Sources: Commercial and Industrial Solid Waste Incineration Units; Technical Amendments,Rule,Environmental Protection Agency,"Following requests for clarification of its June 2016 final action, the Environmental Protection Agency (EPA) published proposed amendments to several provisions of the 2016 New Source Performance Standards (NSPS) and Emission Guidelines (EG) for Commercial and Industrial Solid Waste Incineration (CISWI). This action finalizes the proposed amendments, which provide clarity and address implementation issues in the final CISWI NSPS and EG, as well as correcting inconsistencies and errors in these provisions.",84 FR 15846, 2019-05529,https://www.federalregister.gov/documents/2019/04/16/2019-05529/standards-of-performance-for-new-stationary-sources-and-emission-guidelines-for-existing-sources,https://www.govinfo.gov/content/pkg/FR-2019-04-16/pdf/2019-05529.pdf,04/16/2019
National Pollutant Discharge Elimination System-Final Regulations To Establish Requirements for Cooling Water Intake Structures at Existing Facilities and Amend Requirements at Phase I Facilities,Rule,Environmental Protection Agency,"The purpose of this action is to reduce impingement and entrainment of fish and other aquatic organisms at cooling water intake structures used by certain existing power generation and manufacturing facilities for the withdrawal of cooling water from waters of the United States. This rule establishes requirements under section 316(b) of the Clean Water Act (CWA) for existing power generating facilities and existing manufacturing and industrial facilities that are designed to withdraw more than 2 million gallons per day (mgd) of water from waters of the United States and use at least 25 percent of the water they withdraw exclusively for cooling purposes. These national requirements, which will be implemented through National Pollutant Discharge Elimination System (NPDES) permits, apply to the location, design, construction, and capacity of cooling water intake structures (CWIS) at regulated facilities and provide requirements that reflect the best technology available (BTA) for minimizing adverse environmental impact. On April 20, 2011, EPA published a proposed rule that included several options for addressing these impacts. Subsequently, EPA published two Notices of Data Availability (NODA), on June 11, 2012 and June 12, 2012, that further clarified EPA's proposed approach. This final rule also responds to judicial remand of aspects of the previously promulgated Phase II and Phase III section 316(b) rules. In addition, EPA is also responding to an earlier judicial decision by removing from the previously promulgated Phase I new facility rule a restoration-based compliance alternative and the associated monitoring and demonstration requirements.",79 FR 48300, 2014-12164,https://www.federalregister.gov/documents/2014/08/15/2014-12164/national-pollutant-discharge-elimination-system-final-regulations-to-establish-requirements-for,https://www.govinfo.gov/content/pkg/FR-2014-08-15/pdf/2014-12164.pdf,08/15/2014
New Source Performance Standards for the Synthetic Organic Chemical Manufacturing Industry and National Emission Standards for Hazardous Air Pollutants for the Synthetic Organic Chemical Manufacturing Industry and Group I & II Polymers and Resins Industry,Rule,Environmental Protection Agency,"This action finalizes amendments to the New Source Performance Standards (NSPS) that apply to the Synthetic Organic Chemical Manufacturing Industry (SOCMI) and amendments to the National Emission Standards for Hazardous Air Pollutants (NESHAP) that apply to the SOCMI (more commonly referred to as the Hazardous Organic NESHAP or HON) and Group I and II Polymers and Resins (P&R I and P&R II, respectively) Industries. The EPA is finalizing decisions resulting from the Agency's technology review of the HON and the P&R I and P&R II NESHAP, and its review of the NSPS that apply to the SOCMI. The EPA is also finalizing amendments to the NSPS for equipment leaks of volatile organic compounds (VOC) in SOCMI based on its reconsideration of certain issues raised in an administrative petition for reconsideration. Furthermore, the EPA is finalizing emission standards for ethylene oxide (EtO) emissions and chloroprene emissions after considering the results of a risk assessment for the HON and for Neoprene Production processes subject to the P&R I NESHAP, and is finalizing a fenceline monitoring work practice standard for certain hazardous air pollutants (HAP). Lastly, the EPA is finalizing the removal of exemptions from standards for periods of startup, shutdown, and malfunction (SSM), adding work practice standards for such periods where appropriate, finalizing standards for previously unregulated HAP, and adding provisions for electronic reporting of performance test reports and periodic reports.",89 FR 42932, 2024-07002,https://www.federalregister.gov/documents/2024/05/16/2024-07002/new-source-performance-standards-for-the-synthetic-organic-chemical-manufacturing-industry-and,https://www.govinfo.gov/content/pkg/FR-2024-05-16/pdf/2024-07002.pdf,05/16/2024
"Waste Emissions Charge for Petroleum and Natural Gas Systems: Procedures for Facilitating Compliance, Including Netting and Exemptions",Rule,Environmental Protection Agency,"The Environmental Protection Agency (EPA) is promulgating a regulation to facilitate compliance with the requirements of the Waste Emissions Charge in the Clean Air Act's (CAA) Methane Emissions Reduction Program (MERP). Enacted as part of the Inflation Reduction Act (IRA), this program requires the EPA to impose and collect an annual charge on methane emissions that exceed waste emissions thresholds specified by Congress.",89 FR 91094, 2024-26643,https://www.federalregister.gov/documents/2024/11/18/2024-26643/waste-emissions-charge-for-petroleum-and-natural-gas-systems-procedures-for-facilitating-compliance,https://www.govinfo.gov/content/pkg/FR-2024-11-18/pdf/2024-26643.pdf,11/18/2024
General Permits and Permits by Rule for the Federal Minor New Source Review Program in Indian Country for Five Source Categories,Rule,Environmental Protection Agency,"The U.S. Environmental Protection Agency (EPA) is finalizing general permits for use in Indian country pursuant to the Federal Minor New Source Review (NSR) Program in Indian Country for new or modified minor sources in the following two source categories: Hot mix asphalt (HMA) plants; and stone quarrying, crushing, and screening (SQCS) facilities. The EPA is also finalizing permits by rule for use in Indian country for new or modified minor sources in three source categories: Auto body repair and miscellaneous surface coating operations; gasoline dispensing facilities (GDFs), except in California; and petroleum dry cleaning facilities. The EPA is also taking final action authorizing the use of general permits established under the program to create synthetic minor sources for the HMA and SQCS source categories.",80 FR 25068, 2015-09739,https://www.federalregister.gov/documents/2015/05/01/2015-09739/general-permits-and-permits-by-rule-for-the-federal-minor-new-source-review-program-in-indian,https://www.govinfo.gov/content/pkg/FR-2015-05-01/pdf/2015-09739.pdf,05/01/2015
New Source Performance Standards Review for Volatile Organic Liquid Storage Vessels (Including Petroleum Liquid Storage Vessels),Rule,Environmental Protection Agency,"The Environmental Protection Agency (EPA) is finalizing amendments to the new source performance standards (NSPS) for Volatile Organic Liquid Storage Vessels (Including Petroleum Liquid Storage Vessels) pursuant to the review required by the Clean Air Act (CAA). The EPA is finalizing revisions to the NSPS that are applicable to volatile organic liquid (VOL) storage vessels that commence construction, reconstruction, or modification after October 4, 2023, under a new NSPS subpart, as well as amendments to an existing subpart. In the new NSPS subpart Kc, the EPA is finalizing requirements to reduce the vapor pressure applicability thresholds and revise the volatile organic compound (VOC) standards to reflect the best system of emission reduction (BSER) for affected storage vessels. In addition, the EPA is finalizing degassing emission controls; clarification of startup, shutdown, and malfunction (SSM) requirements; additional monitoring requirements; and other technical improvements",89 FR 83296, 2024-22823,https://www.federalregister.gov/documents/2024/10/15/2024-22823/new-source-performance-standards-review-for-volatile-organic-liquid-storage-vessels-including,https://www.govinfo.gov/content/pkg/FR-2024-10-15/pdf/2024-22823.pdf,10/15/2024
Tolfenpyrad; Pesticide Tolerances for Emergency Exemptions,Rule,Environmental Protection Agency,"This regulation establishes time-limited tolerances for residues of tolfenpyrad in or on dry bulb onion and watermelon. This action is in response to EPA's granting of emergency exemptions under the Federal Insecticide, Fungicide, and Rodenticide Act (FIFRA) authorizing use of the pesticide on dry bulb onion and watermelon. This regulation establishes maximum permissible levels for residues of tolfenpyrad in or on these commodities. The time-limited tolerances expire on December 31, 2020.",82 FR 46929, 2017-21797,https://www.federalregister.gov/documents/2017/10/10/2017-21797/tolfenpyrad-pesticide-tolerances-for-emergency-exemptions,https://www.govinfo.gov/content/pkg/FR-2017-10-10/pdf/2017-21797.pdf,10/10/2017
Mandatory Reporting of Greenhouse Gases: Technical Revisions to the Petroleum and Natural Gas Systems Category of the Greenhouse Gas Reporting Rule,Rule,Environmental Protection Agency,"EPA is finalizing technical corrections and revisions to the petroleum and natural gas systems source category of the Greenhouse Gas Reporting Rule. Final changes include providing clarification on existing requirements, increasing flexibility for certain calculation methods, amending data reporting requirements, clarifying terms and definitions, and technical corrections.",76 FR 80554, 2011-31532,https://www.federalregister.gov/documents/2011/12/23/2011-31532/mandatory-reporting-of-greenhouse-gases-technical-revisions-to-the-petroleum-and-natural-gas-systems,https://www.govinfo.gov/content/pkg/FR-2011-12-23/pdf/2011-31532.pdf,12/23/2011
Review of Standards of Performance for Automobile and Light Duty Truck Surface Coating Operations,Rule,Environmental Protection Agency,"The Environmental Protection Agency (EPA) is finalizing amendments to the new source performance standards for Automobile and Light Duty Truck Surface Coating Operations pursuant to the review required by the Clean Air Act. The EPA determined that revisions to the NSPS were needed to reflect the degree of emission limitation achievable through the application of the best system of emission reduction (BSER). The EPA is therefore finalizing, as proposed, in a new NSPS subpart MMa, revised volatile organic compound (VOC) emission limits for prime coat, guide coat, and topcoat operations for affected facilities that commence construction, modification, or reconstruction after May 18, 2022. In addition, in the new NSPS subpart, the EPA is finalizing the proposed amendments: the addition of work practices to minimize VOC emissions; revision of the plastic parts provision; updates to the capture and control devices and the associated testing and monitoring requirements; revision of the transfer efficiency provisions; new test methods and alternative test methods; revision of the recordkeeping and reporting requirements, including the addition of electronic reporting; removing exemptions for periods of startup, shutdown, and malfunction; and other amendments to harmonize the new NSPS subpart and Automobile and Light Duty Truck Surface Coating National Emission Standards for Hazardous Air Pollutants (NESHAP) requirements. The EPA is also finalizing the proposed electronic reporting requirements in the NSPS subpart MM, applicable to sources that commence construction, reconstruction, or modification after October 5, 1979, and on or before May 18, 2022.",88 FR 29978, 2023-09587,https://www.federalregister.gov/documents/2023/05/09/2023-09587/review-of-standards-of-performance-for-automobile-and-light-duty-truck-surface-coating-operations,https://www.govinfo.gov/content/pkg/FR-2023-05-09/pdf/2023-09587.pdf,05/09/2023
National Emission Standards for Hazardous Air Pollutants and New Source Performance Standards: Petroleum Refinery Sector Amendments,Rule,Environmental Protection Agency,"This action finalizes amendments to the petroleum refinery National Emission Standards for Hazardous Air Pollutants (NESHAP) (referred to as Refinery MACT 1 and Refinery MACT 2) and to the New Source Performance Standards (NSPS) for Petroleum Refineries to clarify the requirements of these rules and to make technical corrections and minor revisions to requirements for work practice standards, recordkeeping, and reporting which were proposed in the Federal Register on April 10, 2018. This action also finalizes amendments to the compliance date of the requirements for existing maintenance vents from August 1, 2017, to December 26, 2018, which were proposed in the Federal Register on July 10, 2018.",83 FR 60696, 2018-25080,https://www.federalregister.gov/documents/2018/11/26/2018-25080/national-emission-standards-for-hazardous-air-pollutants-and-new-source-performance-standards,https://www.govinfo.gov/content/pkg/FR-2018-11-26/pdf/2018-25080.pdf,11/26/2018
National Emission Standards for Hazardous Air Pollutants: Gasoline Distribution Technology Reviews and New Source Performance Standards Review for Bulk Gasoline Terminals,Rule,Environmental Protection Agency,"The Environmental Protection Agency (EPA) is finalizing the technology reviews (TR) conducted for the national emission standards for hazardous air pollutants (NESHAP) for gasoline distribution facilities and the review of the new source performance standards (NSPS) for bulk gasoline terminals pursuant to the requirements of the Clean Air Act (CAA). The final NESHAP amendments include revised requirements for storage vessels, loading operations, and equipment to reflect cost-effective developments in practices, processes, or controls. The final NSPS reflect the best system of emission reduction for loading operations and equipment leaks. In addition, the EPA is: finalizing revisions related to emissions during periods of startup, shutdown, and malfunction (SSM); adding requirements for electronic reporting; revising monitoring and operating requirements for control devices; and making other minor technical improvements. The EPA estimates that this final action will reduce hazardous air pollutant emissions from gasoline distribution facilities by over 2,200 tons per year (tpy) and volatile organic compound (VOC) emissions by 45,400 tpy.",89 FR 39304, 2024-04629,https://www.federalregister.gov/documents/2024/05/08/2024-04629/national-emission-standards-for-hazardous-air-pollutants-gasoline-distribution-technology-reviews,https://www.govinfo.gov/content/pkg/FR-2024-05-08/pdf/2024-04629.pdf,05/08/2024
