title,type,agency_names,abstract,citation,document_number,html_url,pdf_url,publication_date
Regulation of Fuels and Fuel Additives: Changes to Renewable Fuel Standard Program,Rule,Environmental Protection Agency,"Under the Clean Air Act Section 211(o), as amended by the Energy Independence and Security Act of 2007 (EISA), the Environmental Protection Agency is required to promulgate regulations implementing changes to the Renewable Fuel Standard program. The revised statutory requirements specify the volumes of cellulosic biofuel, biomass-based diesel, advanced biofuel, and total renewable fuel that must be used in transportation fuel. This action finalizes the regulations that implement the requirements of EISA, including the cellulosic, biomass- based diesel, advanced biofuel, and renewable fuel standards that will apply to all gasoline and diesel produced or imported in 2010. The final regulations make a number of changes to the current Renewable Fuel Standard program while retaining many elements of the compliance and trading system already in place. This final rule also implements the revised statutory definitions and criteria, most notably the new greenhouse gas emission thresholds for renewable fuels and new limits on renewable biomass feedstocks. This rulemaking marks the first time that greenhouse gas emission performance is being applied in a regulatory context for a nationwide program. As mandated by the statute, our greenhouse gas emission assessments consider the full lifecycle emission impacts of fuel production from both direct and indirect emissions, including significant emissions from land use changes. In carrying out our lifecycle analysis we have taken steps to ensure that the lifecycle estimates are based on the latest and most up-to-date science. The lifecycle greenhouse gas assessments reflected in this rulemaking represent significant improvements in analysis based on information and data received since the proposal. However, we also recognize that lifecycle GHG assessment of biofuels is an evolving discipline and will continue to revisit our lifecycle analyses in the future as new information becomes available. EPA plans to ask the National Academy of Sciences for assistance as we move forward. Based on current analyses we have determined that ethanol from corn starch will be able to comply with the required greenhouse gas (GHG) threshold for renewable fuel. Similarly, biodiesel can be produced to comply with the 50% threshold for biomass-based diesel, sugarcane with the 50% threshold for advanced biofuel and multiple cellulosic-based fuels with their 60% threshold. Additional fuel pathways have also been determined to comply with their thresholds. The assessment for this rulemaking also indicates the increased use of renewable fuels will have important environmental, energy and economic impacts for our Nation.",75 FR 14670, 2010-3851,https://www.federalregister.gov/documents/2010/03/26/2010-3851/regulation-of-fuels-and-fuel-additives-changes-to-renewable-fuel-standard-program,https://www.govinfo.gov/content/pkg/FR-2010-03-26/pdf/2010-3851.pdf,03/26/2010
National Emission Standards for Hazardous Air Pollutants: Asphalt Processing and Asphalt Roofing Manufacturing Residual Risk and Technology Review,Rule,Environmental Protection Agency,"This action finalizes the residual risk and technology review (RTR) conducted for the Asphalt Processing and Asphalt Roofing Manufacturing source categories regulated under national emission standards for hazardous air pollutants (NESHAP). In addition, we are taking final action to: Correct and clarify regulatory provisions related to emissions during periods of startup, shutdown, and malfunction (SSM); revise monitoring requirements for a control device used to comply with the particulate matter (PM) standards; add requirements for periodic performance testing; add electronic reporting of performance test results and reports, performance evaluation reports, compliance reports, and Notification of Compliance Status (NOCS) reports; and include other technical corrections to improve consistency and clarity. We are making no revisions to the numerical emission limits based on the residual risk analysis or technology review. Although these amendments are not anticipated to result in reductions in emissions of hazardous air pollutants (HAP), they will improve compliance and implementation of the rule.",85 FR 14526, 2020-02369,https://www.federalregister.gov/documents/2020/03/12/2020-02369/national-emission-standards-for-hazardous-air-pollutants-asphalt-processing-and-asphalt-roofing,https://www.govinfo.gov/content/pkg/FR-2020-03-12/pdf/2020-02369.pdf,03/12/2020
Source Specific Federal Implementation Plan for Implementing Best Available Retrofit Technology for Four Corners Power Plant: Navajo Nation,Rule,Environmental Protection Agency,"The Environmental Protection Agency (EPA) is promulgating a source-specific Federal Implementation Plan (FIP) requiring the Four Corners Power Plant (FCPP), a coal-fired power plant located on the Navajo Nation near Farmington, New Mexico, to achieve emissions reductions required by the Clean Air Act's (CAA) Best Available Retrofit Technology (BART) provision. In this final action, EPA is requiring FCPP to reduce emissions of oxides of nitrogen (NO<INF>X</INF>) and is setting emission limits for particulate matter (PM) based on emission rates already achieved at FCPP. These pollutants contribute to visibility impairment in the numerous mandatory Class I Federal areas surrounding FCPP. For NO<INF>X</INF> emissions, EPA is requiring FCPP to meet a plant-wide emission limit of 0.11 lb/MMBtu on a rolling 30-day heat input-weighted average. This represents an 80 percent reduction from the current NO<INF>X</INF> emission rate and is expected to provide significant improvement in visibility. EPA is also finalizing an alternative emission control strategy that gives the owners of FCPP the option to close Units 1-3 and install controls on Units 4 and 5 to each meet an emission limit of 0.098 lb/MMBtu, based on a rolling average of 30 successive boiler operating days. For PM, EPA is requiring Units 4 and 5 at FCPP to meet an emission limit of 0.015 lb/MMBtu, and retaining the existing 20 percent opacity limit. These PM limits are achievable through the proper operation of the existing baghouses. EPA is also requiring FCPP to comply with a 20 percent opacity limit on its coal and material handling operations.",77 FR 51620, 2012-19793,https://www.federalregister.gov/documents/2012/08/24/2012-19793/source-specific-federal-implementation-plan-for-implementing-best-available-retrofit-technology-for,https://www.govinfo.gov/content/pkg/FR-2012-08-24/pdf/2012-19793.pdf,08/24/2012
Adoption and Submittal of State Plans for Designated Facilities: Implementing Regulations Under Clean Air Act Section 111(d),Rule,Environmental Protection Agency,"The Environmental Protection Agency (EPA) is finalizing amendments to the regulations that govern the processes and timelines for state and Federal plans to implement emission guidelines under Clean Air Act (CAA) New Source Performance Standards for existing sources (the ""implementing regulations""). The amendments include revisions to the timing requirements for state and the EPA actions related to plans; the addition of mechanisms to improve flexibility and efficiency in plan processes; and new requirements for demonstration of timely meaningful engagement with pertinent stakeholders--including, but not limited to, industry, small businesses, and communities most affected by and vulnerable to the impacts of the plan. This action additionally provides a process for states' consideration of `remaining useful life and other factors' (RULOF) in applying a standard of performance; amends the definition of standard of performance in the implementing regulations; and clarifies compliance flexibilities that states may choose to incorporate into state plans, including trading or averaging. Finally, this action adds requirements for the electronic submission of state plans and provides several other clarifications and minor revisions to the implementing regulations.",88 FR 80480, 2023-25269,https://www.federalregister.gov/documents/2023/11/17/2023-25269/adoption-and-submittal-of-state-plans-for-designated-facilities-implementing-regulations-under-clean,https://www.govinfo.gov/content/pkg/FR-2023-11-17/pdf/2023-25269.pdf,11/17/2023
Hazardous and Solid Waste Management System; Disposal of Coal Combustion Residuals From Electric Utilities,Rule,Environmental Protection Agency,"The Environmental Protection Agency (EPA or the Agency) is publishing a final rule to regulate the disposal of coal combustion residuals (CCR) as solid waste under subtitle D of the Resource Conservation and Recovery Act (RCRA). The available information demonstrates that the risks posed to human health and the environment by certain CCR management units warrant regulatory controls. EPA is finalizing national minimum criteria for existing and new CCR landfills and existing and new CCR surface impoundments and all lateral expansions consisting of location restrictions, design and operating criteria, groundwater monitoring and corrective action, closure requirements and post closure care, and recordkeeping, notification, and internet posting requirements. The rule requires any existing unlined CCR surface impoundment that is contaminating groundwater above a regulated constituent's groundwater protection standard to stop receiving CCR and either retrofit or close, except in limited circumstances. It also requires the closure of any CCR landfill or CCR surface impoundment that cannot meet the applicable performance criteria for location restrictions or structural integrity. Finally, those CCR surface impoundments that do not receive CCR after the effective date of the rule, but still contain water and CCR will be subject to all applicable regulatory requirements, unless the owner or operator of the facility dewaters and installs a final cover system on these inactive units no later than three years from publication of the rule. EPA is deferring its final decision on the Bevill Regulatory Determination because of regulatory and technical uncertainties that cannot be resolved at this time.",80 FR 21302, 2015-00257,https://www.federalregister.gov/documents/2015/04/17/2015-00257/hazardous-and-solid-waste-management-system-disposal-of-coal-combustion-residuals-from-electric,https://www.govinfo.gov/content/pkg/FR-2015-04-17/pdf/2015-00257.pdf,04/17/2015
National Emission Standards for Hazardous Air Pollutants: Surface Coating of Metal Cans and Surface Coating of Metal Coil Residual Risk and Technology Reviews,Rule,Environmental Protection Agency,"The U.S. Environmental Protection Agency (EPA) is taking final action on the residual risk and technology reviews (RTRs) conducted for the Surface Coating of Metal Cans and Surface Coating of Metal Coil source categories regulated under national emission standards for hazardous air pollutants (NESHAP). The EPA is also taking final action on amendments for the two source categories to address emissions during periods of startup, shutdown, and malfunction (SSM); electronic reporting of performance test results and compliance reports; the addition of EPA Method 18 and updates to several measurement methods; and the addition of requirements for periodic performance testing. Additionally, several miscellaneous technical amendments are being made to improve the clarity of the rule requirements. We are making no revisions to the numerical emission limits for the two source categories based on the residual risk and technology reviews.",85 FR 10828, 2020-00303,https://www.federalregister.gov/documents/2020/02/25/2020-00303/national-emission-standards-for-hazardous-air-pollutants-surface-coating-of-metal-cans-and-surface,https://www.govinfo.gov/content/pkg/FR-2020-02-25/pdf/2020-00303.pdf,02/25/2020
Greenhouse Gas Emissions and Fuel Efficiency Standards for Medium- and Heavy-Duty Engines and Vehicles-Phase 2,Rule,Environmental Protection Agency,"EPA and NHTSA, on behalf of the Department of Transportation, are establishing rules for a comprehensive Phase 2 Heavy-Duty (HD) National Program that will reduce greenhouse gas (GHG) emissions and fuel consumption from new on-road medium- and heavy-duty vehicles and engines. NHTSA's fuel consumption standards and EPA's carbon dioxide (CO<INF>2</INF>) emission standards are tailored to each of four regulatory categories of heavy-duty vehicles: Combination tractors; trailers used in combination with those tractors; heavy-duty pickup trucks and vans; and vocational vehicles. The rule also includes separate standards for the engines that power combination tractors and vocational vehicles. Certain requirements for control of GHG emissions are exclusive to the EPA program. These include EPA's hydrofluorocarbon standards to control leakage from air conditioning systems in vocational vehicles and EPA's nitrous oxide (N<INF>2</INF>O) and methane (CH<INF>4</INF>) standards for heavy-duty engines. Additionally, NHTSA is addressing misalignment between the Phase 1 EPA GHG standards and the NHTSA fuel efficiency standards to virtually eliminate the differences. This action also includes certain EPA- specific provisions relating to control of emissions of pollutants other than GHGs. EPA is finalizing non-GHG emission standards relating to the use of diesel auxiliary power units installed in new tractors. In addition, EPA is clarifying the classification of natural gas engines and other gaseous-fueled heavy-duty engines. EPA is also finalizing technical amendments to EPA rules that apply to emissions of non-GHG pollutants from light-duty motor vehicles, marine diesel engines, and other nonroad engines and equipment. Finally, EPA is requiring that engines from donor vehicles installed in new glider vehicles meet the emission standards applicable in the year of assembly of the new glider vehicle, including all applicable standards for criteria pollutants, with limited exceptions for small businesses and for other special circumstances.",81 FR 73478, 2016-21203,https://www.federalregister.gov/documents/2016/10/25/2016-21203/greenhouse-gas-emissions-and-fuel-efficiency-standards-for-medium--and-heavy-duty-engines-and,https://www.govinfo.gov/content/pkg/FR-2016-10-25/pdf/2016-21203.pdf,10/25/2016
"Protection of Stratospheric Ozone: Adjustments to the Allowance System for Controlling HCFC Production, Import, and Export",Rule,Environmental Protection Agency,"EPA is adjusting the allowance system controlling U.S. consumption and production of hydrochlorofluorocarbons (HCFCs) as a result of a 2010 Court decision vacating a portion of the 2009 final rule titled ""Protection of Stratospheric Ozone: Adjustments to the Allowance System for Controlling HCFC Production, Import, and Export."" EPA interprets the Court's vacatur as applying to the part of the rule that establishes the company-by-company baselines and calendar year allowances for HCFC-22 and HCFC-142b. On August 5, 2011, EPA published an interim final rule allocating allowances for 2011. Today's action relieves the regulatory ban on production and consumption of these two chemicals following the Court's vacatur by establishing company-by- company HCFC-22 and HCFC-142b baselines and allocating production and consumption allowances for 2012-2014.",78 FR 20004, 2013-07758,https://www.federalregister.gov/documents/2013/04/03/2013-07758/protection-of-stratospheric-ozone-adjustments-to-the-allowance-system-for-controlling-hcfc,https://www.govinfo.gov/content/pkg/FR-2013-04-03/pdf/2013-07758.pdf,04/03/2013
Protection of Stratospheric Ozone: Update to the Refrigerant Management Requirements Under the Clean Air Act,Rule,Environmental Protection Agency,"The Clean Air Act prohibits the knowing release of ozone- depleting and substitute refrigerants during the course of maintaining, servicing, repairing, or disposing of appliances or industrial process refrigeration. The existing regulations require that persons maintaining, servicing, repairing, or disposing of air-conditioning and refrigeration equipment containing more than 50 pounds of refrigerant observe certain service practices that reduce emissions of ozone- depleting refrigerant. This rule updates those existing requirements as well as extends them, as appropriate, to non-ozone depleting substitute refrigerants, such as hydrofluorocarbons. Updates include strengthened leak repair requirements, recordkeeping requirements for the disposal of appliances containing more than five and less than 50 pounds of refrigerant, revisions to the technician certification program, and revisions for improved readability and compliance. As a result, this action reduces emissions of ozone-depleting substances and gases with high global warming potentials.",81 FR 82272, 2016-24215,https://www.federalregister.gov/documents/2016/11/18/2016-24215/protection-of-stratospheric-ozone-update-to-the-refrigerant-management-requirements-under-the-clean,https://www.govinfo.gov/content/pkg/FR-2016-11-18/pdf/2016-24215.pdf,11/18/2016
National Pollutant Discharge Elimination System (NPDES) Electronic Reporting Rule,Rule,Environmental Protection Agency,"The Environmental Protection Agency (EPA) is publishing this final regulation that requires the electronic reporting and sharing of Clean Water Act National Pollutant Discharge Elimination System (NPDES) program information instead of the current paper-based reporting of this information. This action will save time and resources for permittees, states, tribes, territories, and the U.S. Government while increasing data accuracy, improving compliance, and supporting EPA's goal of providing better protection of the nation's waters. By modernizing this Clean Water Act reporting program, permittees and regulators will use existing, available information technology to electronically report information and data related to the NPDES permit program. This regulation will help provide greater clarity on who is and who is not in compliance and enhances transparency by providing a timelier, complete, more accurate, and nationally-consistent set of data about the NPDES program. By providing improved data in a more accessible form, this final rulemaking will improve the ability of EPA and authorized NPDES programs to target the most serious water quality and compliance problems. Furthermore, by reducing the time and resources devoted to outdated data management activities, the rule could allow authorized NPDES programs to shift limited resources to important water quality and public health protection activities. The transition from paper to electronic reporting will require close coordination and cooperation between EPA and authorized NPDES programs. This regulation provides important flexibility while still implementing electronic reporting in a timely and effective fashion.",80 FR 64064, 2015-24954,https://www.federalregister.gov/documents/2015/10/22/2015-24954/national-pollutant-discharge-elimination-system-npdes-electronic-reporting-rule,https://www.govinfo.gov/content/pkg/FR-2015-10-22/pdf/2015-24954.pdf,10/22/2015
National Emission Standards for Hazardous Air Pollutants: Paper and Other Web Coating Residual Risk and Technology Review,Rule,Environmental Protection Agency,"This action finalizes the residual risk and technology review (RTR) conducted for the Paper and Other Web Coating (POWC) source category regulated under national emission standards for hazardous air pollutants (NESHAP). The Agency is finalizing the proposed determination that risks due to emissions of air toxics are acceptable from this source category and that the current NESHAP provides an ample margin of safety to protect public health. Further, the U.S. Environmental Protection Agency (EPA) identified no new cost-effective controls under the technology review that would achieve significant further emissions reductions, and, thus, is finalizing the proposed determination that no revisions to the standards are necessary based on developments in practices, processes, or control technologies. In addition, the Agency is taking final action addressing startup, shutdown, and malfunction (SSM). These final amendments address emissions during SSM events, add a compliance demonstration equation that accounts for retained volatiles in the coated web; add repeat testing and electronic reporting requirements; and make technical and editorial changes. The EPA is making these amendments to improve the effectiveness of the NESHAP, and although these amendments are not expected to reduce emissions of hazardous air pollutants (HAP), they will improve monitoring, compliance, and implementation of the rule.",85 FR 41276, 2020-05854,https://www.federalregister.gov/documents/2020/07/09/2020-05854/national-emission-standards-for-hazardous-air-pollutants-paper-and-other-web-coating-residual-risk,https://www.govinfo.gov/content/pkg/FR-2020-07-09/pdf/2020-05854.pdf,07/09/2020
Significant New Use Rules on Certain Chemical Substances,Rule,Environmental Protection Agency,"EPA is promulgating significant new use rules (SNURs) under the Toxic Substances Control Act (TSCA) for 37 chemical substances which were the subject of premanufacture notices (PMNs). The applicable review periods for the PMNs submitted for these 37 chemical substances all ended prior to June 22, 2016 (i.e., the date on which President Obama signed into law the Frank R. Lautenberg Chemical Safety for the 21st Century Act which amends TSCA). Six of these chemical substances are subject to TSCA section 5(e) consent orders issued by EPA. This action requires persons who intend to manufacture (defined by statute to include import) or process any of these 37 chemical substances for an activity that is designated as a significant new use by this rule to notify EPA at least 90 days before commencing that activity. The required notification initiates EPA's evaluation of the intended use within the applicable review period. Manufacture and processing for the significant new use is unable to commence until EPA has conducted a review of the notice, made an appropriate determination on the notice, and take such actions as are required with that determination.",82 FR 44079, 2017-20158,https://www.federalregister.gov/documents/2017/09/21/2017-20158/significant-new-use-rules-on-certain-chemical-substances,https://www.govinfo.gov/content/pkg/FR-2017-09-21/pdf/2017-20158.pdf,09/21/2017
"NESHAP: Surface Coating of Automobiles and Light-Duty Trucks; Miscellaneous Metal Parts and Products; Plastic Parts and Products; Large Appliances; Printing, Coating, and Dyeing of Fabrics and Other Textiles; and Metal Furniture Residual Risk and Technology Reviews",Rule,Environmental Protection Agency,"The U.S. Environmental Protection Agency (EPA) is taking final action on the residual risk and technology reviews (RTRs) conducted for the Surface Coating of Automobiles and Light-Duty Trucks (ALDT); Surface Coating of Miscellaneous Metal Parts and Products (MMPP); and the Surface Coating of Plastic Parts and Products (PPP) source categories regulated under national emission standards for hazardous air pollutants (NESHAP). These final amendments also address emissions during periods of startup, shutdown, and malfunction (SSM); electronic reporting of performance test results and compliance reports; the addition of EPA Method 18 and updates to several measurement methods; and the addition of requirements for periodic performance testing. Several miscellaneous technical amendments were also made to improve the clarity of the rule requirements. We are making no revisions to the numerical emission limits based on these risk analyses or technology reviews. This notice also finalizes technical corrections to the NESHAP for Surface Coating of Large Appliances; NESHAP for Printing, Coating, and Dyeing of Fabrics and Other Textiles; and NESHAP for Surface Coating of Metal Furniture.",85 FR 41100, 2020-05908,https://www.federalregister.gov/documents/2020/07/08/2020-05908/neshap-surface-coating-of-automobiles-and-light-duty-trucks-miscellaneous-metal-parts-and-products,https://www.govinfo.gov/content/pkg/FR-2020-07-08/pdf/2020-05908.pdf,07/08/2020
"National Emission Standards for Hazardous Air Pollutants: Surface Coating of Large Appliances; Printing, Coating, and Dyeing of Fabrics and Other Textiles; and Surface Coating of Metal Furniture Residual Risk and Technology Reviews",Rule,Environmental Protection Agency,"The Environmental Protection Agency (EPA) is taking final action on the residual risk and technology reviews (RTRs) conducted for the Surface Coating of Large Appliances; the Printing, Coating, and Dyeing of Fabrics and Other Textiles; and the Surface Coating of Metal Furniture source categories regulated under national emission standards for hazardous air pollutants (NESHAP). In addition, we are taking final action addressing emissions during periods of startup, shutdown, and malfunction (SSM); electronic reporting for performance test results and compliance reports; the addition of EPA Method 18 and updates to several measurement methods; and the addition of requirements for periodic performance testing. Additionally, several miscellaneous technical amendments will be made to improve the clarity of the rule requirements. We are making no revisions to the numerical emission limits based on these risk analyses or technology reviews.",84 FR 9590, 2019-03560,https://www.federalregister.gov/documents/2019/03/15/2019-03560/national-emission-standards-for-hazardous-air-pollutants-surface-coating-of-large-appliances,https://www.govinfo.gov/content/pkg/FR-2019-03-15/pdf/2019-03560.pdf,03/15/2019
