title,type,agency_names,abstract,citation,document_number,html_url,pdf_url,publication_date
Notice of Funding Availability for Applications for Credit Assistance Under the Water Infrastructure Finance and Innovation Act (WIFIA) Program,Rule,Environmental Protection Agency,"In the Further Consolidated Appropriations Act, 2020, signed by the President on December 20, 2019, Congress provided $50 million in budget authority for the Water Infrastructure Finance and Innovation Act of 2014 (WIFIA) program to cover the subsidy required to provide a much larger amount of credit assistance. The Environmental Protection Agency (EPA or the Agency) estimates that this budget authority may provide approximately $5 billion in credit assistance and may finance approximately $10 billion in water infrastructure investment, while covering increased costs associated with implementing a larger program. The purpose of this notice of funding availability (NOFA) is to solicit letters of interest (LOIs) from prospective borrowers seeking credit assistance from EPA. EPA will evaluate and select proposed projects described in the LOIs using the selection criteria established in statute and regulation, and further described in this NOFA as well as the WIFIA program handbook. This NOFA establishes relative weights that will be used in the current LOI submittal period for the selection criteria, introduces new budgetary scoring factors to determine budgetary scoring compliance, and outlines the process that prospective borrowers should follow to be considered for WIFIA credit assistance. In addition, EPA reserves the right to make additional awards using FY 2020 appropriated funding or available carry-over resources, consistent with Agency policy and guidance, if additional funding is available after the original selections are made. This could include holding a subsequent selection round.",85 FR 43452, 2020-15470,https://www.federalregister.gov/documents/2020/07/17/2020-15470/notice-of-funding-availability-for-applications-for-credit-assistance-under-the-water-infrastructure,https://www.govinfo.gov/content/pkg/FR-2020-07-17/pdf/2020-15470.pdf,07/17/2020
The Navigable Waters Protection Rule: Definition of â€śWaters of the United Statesâ€?Rule,Rule,Defense Department; Engineers Corps; Environmental Protection Agency,"The Environmental Protection Agency and the Department of the Army are publishing a final rule defining the scope of waters federally regulated under the Clean Water Act. The Navigable Waters Protection Rule is the second step in a comprehensive, two-step process intended to review and revise the definition of ""waters of the United States"" consistent with the Executive Order signed on February 28, 2017, ""Restoring the Rule of Law, Federalism, and Economic Growth by Reviewing the `Waters of the United States' Rule."" Once effective, it replaces the rule published on October 22, 2019. This final rule implements the overall objective of the Clean Water Act to restore and maintain the integrity of the nation's waters by maintaining federal authority over those waters that Congress determined should be regulated by the Federal government under its Commerce Clause powers, while adhering to Congress' policy directive to preserve States' primary authority over land and water resources. This final definition increases the predictability and consistency of Clean Water Act programs by clarifying the scope of ""waters of the United States"" federally regulated under the Act.",85 FR 22250, 2020-02500,https://www.federalregister.gov/documents/2020/04/21/2020-02500/the-navigable-waters-protection-rule-definition-of-waters-of-the-united-states,https://www.govinfo.gov/content/pkg/FR-2020-04-21/pdf/2020-02500.pdf,04/21/2020
New Source Performance Standards Review for Secondary Lead Smelters,Rule,Environmental Protection Agency,"The Environmental Protection Agency (EPA) is finalizing amendments to the new source performance standards (NSPS) for secondary lead smelters pursuant to the periodic review required by the Clean Air Act (CAA). Specifically, the EPA is finalizing revisions to the NSPS that applies to affected secondary lead smelters constructed, reconstructed, or modified after December 1, 2022 (NSPS subpart La). The EPA is also finalizing amendments to the NSPS for secondary lead smelters constructed, reconstructed, or modified after June 11, 1973, and on or before December 1, 2022, (NSPS subpart L). In addition, we are finalizing the use of EPA Method 22 (Visual Determination of Fugitive Emissions from Material Sources and Smoke Emissions from Flares) as an alternative for demonstrating compliance with the opacity limit.",88 FR 80594, 2023-25275,https://www.federalregister.gov/documents/2023/11/20/2023-25275/new-source-performance-standards-review-for-secondary-lead-smelters,https://www.govinfo.gov/content/pkg/FR-2023-11-20/pdf/2023-25275.pdf,11/20/2023
"Oil and Natural Gas Sector: Emission Standards for New, Reconstructed, and Modified Sources; Amendments",Rule,Environmental Protection Agency,"This action finalizes amendments of certain requirements that are contained within the final rule titled ""Oil and Natural Gas Sector: Emission Standards for New, Reconstructed, and Modified Sources,"" published in the Federal Register on June 3, 2016 (2016 Rule). The Environmental Protection Agency (EPA) is finalizing amendments of two narrow provisions of the requirements for the collection of fugitive emission components at well sites and compressor stations: Removes the requirement for completion of delayed repair during unscheduled or emergency vent blowdowns, and provides separate monitoring requirements for well sites located on the Alaskan North Slope.",83 FR 10628, 2018-04431,https://www.federalregister.gov/documents/2018/03/12/2018-04431/oil-and-natural-gas-sector-emission-standards-for-new-reconstructed-and-modified-sources-amendments,https://www.govinfo.gov/content/pkg/FR-2018-03-12/pdf/2018-04431.pdf,03/12/2018
Federal â€śGood Neighbor Planâ€?for the 2015 Ozone National Ambient Air Quality Standards,Rule,Environmental Protection Agency,"This action finalizes Federal Implementation Plan (FIP) requirements to address 23 states' obligations to eliminate significant contribution to nonattainment, or interference with maintenance, of the 2015 ozone National Ambient Air Quality Standards (NAAQS) in other states. The U.S. Environmental Protection Agency (EPA) is taking this action under the ""good neighbor"" or ""interstate transport"" provision of the Clean Air Act (CAA or Act). The Agency is defining the amount of ozone-precursor emissions (specifically, nitrogen oxides) that constitute significant contribution to nonattainment and interference with maintenance from these 23 states. With respect to fossil fuel-fired power plants in 22 states, this action will prohibit those emissions by implementing an allowance-based trading program beginning in the 2023 ozone season. With respect to certain other industrial stationary sources in 20 states, this action will prohibit those emissions through emissions limitations and associated requirements beginning in the 2026 ozone season. These industrial source types are: reciprocating internal combustion engines in Pipeline Transportation of Natural Gas; kilns in Cement and Cement Product Manufacturing; reheat furnaces in Iron and Steel Mills and Ferroalloy Manufacturing; furnaces in Glass and Glass Product Manufacturing; boilers in Iron and Steel Mills and Ferroalloy Manufacturing, Metal Ore Mining, Basic Chemical Manufacturing, Petroleum and Coal Products Manufacturing, and Pulp, Paper, and Paperboard Mills; and combustors and incinerators in Solid Waste Combustors and Incinerators.",88 FR 36654, 2023-05744,https://www.federalregister.gov/documents/2023/06/05/2023-05744/federal-good-neighbor-plan-for-the-2015-ozone-national-ambient-air-quality-standards,https://www.govinfo.gov/content/pkg/FR-2023-06-05/pdf/2023-05744.pdf,06/05/2023
Phasedown of Hydrofluorocarbons: Management of Certain Hydrofluorocarbons and Substitutes Under the American Innovation and Manufacturing Act of 2020,Rule,Environmental Protection Agency,"The U.S. Environmental Protection Agency is issuing regulations to implement certain provisions of the American Innovation and Manufacturing Act of 2020. This rulemaking establishes an emissions reduction and reclamation program for the management of hydrofluorocarbons that includes requirements for leak repair and installation and use of automatic leak detection systems for certain equipment using refrigerants containing hydrofluorocarbons and certain substitutes; the servicing and/or repair of certain refrigerant- containing equipment to be done with reclaimed hydrofluorocarbons; the initial installation and servicing and/or repair of fire suppression equipment to be done with recycled hydrofluorocarbons, technician training, and recycling of hydrofluorocarbons prior to the disposal of fire suppression equipment containing hydrofluorocarbons; removal of hydrofluorocarbons from disposable cylinders before discarding them; and certain recordkeeping, reporting, and labeling requirements. In addition, EPA is establishing alternative Resource Conservation and Recovery Act standards for certain ignitable spent refrigerants being recycled for reuse.",89 FR 82682, 2024-21967,https://www.federalregister.gov/documents/2024/10/11/2024-21967/phasedown-of-hydrofluorocarbons-management-of-certain-hydrofluorocarbons-and-substitutes-under-the,https://www.govinfo.gov/content/pkg/FR-2024-10-11/pdf/2024-21967.pdf,10/11/2024
Final National Pollutant Discharge Elimination System (NPDES) General Permit for Stormwater Discharges From Construction Activities,Notice,Environmental Protection Agency,"All ten EPA Regions today are issuing the 2017 National Pollutant Discharge Elimination System (NPDES) general permit for stormwater discharges from construction activities to waters of the United States, also referred to as the ""2017 Construction General Permit (CGP)."" The 2017 CGP replaces the existing general permit (the ""2012 CGP"") covering stormwater discharges from construction activities that expires on February 16, 2017. EPA is issuing this permit for five (5) years, during which time the permit will make available coverage to eligible operators in all areas of the country where EPA is the NPDES permitting authority. This Federal Register notice describes the 2017 CGP in general and provides a summary of the significant changes from the 2012 CGP.",82 FR 6534, 2017-01231,https://www.federalregister.gov/documents/2017/01/19/2017-01231/final-national-pollutant-discharge-elimination-system-npdes-general-permit-for-stormwater-discharges,https://www.govinfo.gov/content/pkg/FR-2017-01-19/pdf/2017-01231.pdf,01/19/2017
Revised Definition of â€śWaters of the United Statesâ€? Conforming,Rule,Defense Department; Engineers Corps; Environmental Protection Agency,"The Environmental Protection Agency (EPA) and the Department of the Army (""the agencies"") are amending the Code of Federal Regulations (CFR) to conform the definition of ""waters of the United States"" to a 2023 Supreme Court decision. This conforming rule amends the provisions of the agencies' definition of ""waters of the United States"" that are invalid under the Supreme Court's interpretation of the Clean Water Act in the 2023 decision.",88 FR 61964, 2023-18929,https://www.federalregister.gov/documents/2023/09/08/2023-18929/revised-definition-of-waters-of-the-united-states-conforming,https://www.govinfo.gov/content/pkg/FR-2023-09-08/pdf/2023-18929.pdf,09/08/2023
National Pollutant Discharge Elimination System (NPDES) 2021 Issuance of the Multi-Sector General Permit for Stormwater Discharges Associated With Industrial Activity,Notice,Environmental Protection Agency,"All 10 of the Environmental Protection Agency's (EPA) Regions are finalizing the 2021 National Pollutant Discharge Elimination System (NPDES) general permit for stormwater discharges associated with industrial activity, also referred to as the ""2021 Multi-Sector General Permit (MSGP)"" or the ""final permit."" This final permit replaces EPA's administratively continued 2015 MSGP that expired on June 3, 2020. EPA is issuing this permit for five (5) years to provide permit coverage to eligible operators in all areas of the country where EPA is the NPDES permitting authority, including Idaho (until July 1, 2021), Massachusetts, New Hampshire, New Mexico, Indian country lands, Puerto Rico, the District of Columbia, and most U.S. territories and protectorates. This Federal Register document summarizes the final permit. EPA encourages the public to read the final permit and accompanying fact sheet to better understand the final permit. The final permit and fact sheet can be found at https://www.epa.gov/npdes/ stormwater-discharges-industrial-activities.",86 FR 10269, 2021-03391,https://www.federalregister.gov/documents/2021/02/19/2021-03391/national-pollutant-discharge-elimination-system-npdes-2021-issuance-of-the-multi-sector-general,https://www.govinfo.gov/content/pkg/FR-2021-02-19/pdf/2021-03391.pdf,02/19/2021
Treatment of Data Influenced by Exceptional Events,Rule,Environmental Protection Agency,"The Environmental Protection Agency (EPA) is finalizing revisions to certain sections within the regulations that govern the exclusion of event-influenced air quality data from certain regulatory decisions under the Clean Air Act (CAA). The EPA's mission includes preserving and improving the quality of our nation's ambient air to protect human health and the environment, and the CAA and the EPA's regulations rely heavily on ambient air quality data. However, the CAA also recognizes that it may not be appropriate to use the monitoring data influenced by ""exceptional"" events that are collected by the ambient air quality monitoring network when making certain regulatory determinations. When ""exceptional"" events cause exceedances or violations of the national ambient air quality standards (NAAQS) that subsequently affect certain regulatory decisions, the normal planning and regulatory process established by the CAA may not be appropriate. This final rule contains definitions, procedural requirements, requirements for air agency demonstrations, criteria for the EPA's approval of the exclusion of event-influenced air quality data and requirements for air agencies to take appropriate and reasonable actions to protect public health from exceedances or violations of the NAAQS. It reflects the experiences of the EPA, state, local and tribal air agencies, federal land managers and other stakeholders in implementing this program over the past 10 years. These regulatory revisions, the EPA's commitment to improved communications, our focus on decisions with regulatory significance, and the expressed non- binding guidance in the preamble regarding recommendations for demonstration narrative and analyses to include in demonstration packages, protect human health and the environment while providing needed clarity, increasing the administrative efficiency of demonstration submittal process, and removing some of the challenges associated with implementing the Exceptional Events Rule. As part of the EPA's mission to protect public health, this action promulgates new requirements for mitigation plans for areas with known, recurring events. We are simultaneously using this action to provide written notification to those states with areas that are initially subject to these new requirements. In addition to finalizing revisions to the Exceptional Events Rule, the EPA is also announcing the availability of the final version of the non-binding guidance document titled Guidance on the Preparation of Exceptional Events Demonstrations for Wildfire Events that May Influence Ozone Concentrations, which applies the rule revisions to wildfire events that could influence monitored ozone concentrations.",81 FR 68216, 2016-22983,https://www.federalregister.gov/documents/2016/10/03/2016-22983/treatment-of-data-influenced-by-exceptional-events,https://www.govinfo.gov/content/pkg/FR-2016-10-03/pdf/2016-22983.pdf,10/03/2016
Accidental Release Prevention Requirements: Risk Management Programs Under the Clean Air Act; Safer Communities by Chemical Accident Prevention,Rule,Environmental Protection Agency,"The Environmental Protection Agency (EPA) is amending its Risk Management Program (RMP) regulations as a result of Agency review. The revisions include several changes and amplifications to the accident prevention program requirements, enhancements to the emergency preparedness requirements, improvements to the public availability of chemical hazard information, and several other changes to certain regulatory definitions or points of clarification. As major and other serious and concerning RMP accidents continue to occur, the record shows and EPA believes that this final rule will help further protect human health and the environment from chemical hazards through advancement of process safety based on lessons learned. These amendments seek to improve chemical process safety; assist in planning, preparedness, and response to Risk Management Program-reportable accidents; and improve public awareness of chemical hazards at regulated sources. While many of the provisions of this final rule reinforce each other, it is EPA's intent that each one is merited on its own, and thus severable.",89 FR 17622, 2024-04458,https://www.federalregister.gov/documents/2024/03/11/2024-04458/accidental-release-prevention-requirements-risk-management-programs-under-the-clean-air-act-safer,https://www.govinfo.gov/content/pkg/FR-2024-03-11/pdf/2024-04458.pdf,03/11/2024
Notice of Funding Availability (NOFA) for Applications for Credit Assistance Under the Water Infrastructure Finance and Innovation Act (WIFIA) Program,Notice,Environmental Protection Agency,"In the Consolidated Appropriations Act, 2018, signed by the President on March 23, 2018, Congress provided at least $55 million in budget authority for the Water Infrastructure Finance and Innovation Act of 2014 (WIFIA) program to cover the subsidy required to provide a much larger amount of credit assistance. The Environmental Protection Agency (EPA) estimates that this budget authority may provide approximately $5.5 billion in credit assistance and may finance approximately $11 billion in water infrastructure investment, while covering increased costs associated with implementing a larger program. The purpose of this notice of funding availability (NOFA) is to solicit letters of interest (LOIs) from prospective borrowers seeking credit assistance from EPA.",83 FR 15828, 2018-07513,https://www.federalregister.gov/documents/2018/04/12/2018-07513/notice-of-funding-availability-nofa-for-applications-for-credit-assistance-under-the-water,https://www.govinfo.gov/content/pkg/FR-2018-04-12/pdf/2018-07513.pdf,04/12/2018
National Emission Standards for Hazardous Air Pollutants: Stationary Combustion Turbines Residual Risk and Technology Review,Rule,Environmental Protection Agency,"This action finalizes the residual risk and technology review (RTR) conducted for the Stationary Combustion Turbines source category regulated under national emission standards for hazardous air pollutants (NESHAP). In addition, we are taking final action addressing requirements during periods of startup, shutdown, and malfunction (SSM) and to add electronic reporting requirements. The EPA is finalizing our proposed determination that the risks from this source category due to emissions of air toxics are acceptable and that the existing NESHAP provides an ample margin of safety to protect public health. The EPA is also finalizing our proposed determination that we identified no new cost-effective controls under the technology review that would achieve further emissions reductions from the source category.",85 FR 13524, 2020-02714,https://www.federalregister.gov/documents/2020/03/09/2020-02714/national-emission-standards-for-hazardous-air-pollutants-stationary-combustion-turbines-residual,https://www.govinfo.gov/content/pkg/FR-2020-03-09/pdf/2020-02714.pdf,03/09/2020
"Oil Pollution Prevention; Spill Prevention, Control, and Countermeasure (SPCC) Rule-Compliance Date Amendment for Farms",Rule,Environmental Protection Agency,"EPA is taking direct final action to amend the date by which farms must prepare or amend, and implement their Spill Prevention, Control, and Countermeasure Plans to May 10, 2013.",76 FR 64245, 2011-27047,https://www.federalregister.gov/documents/2011/10/18/2011-27047/oil-pollution-prevention-spill-prevention-control-and-countermeasure-spcc-rule-compliance-date,https://www.govinfo.gov/content/pkg/FR-2011-10-18/pdf/2011-27047.pdf,10/18/2011
Multi-Pollutant Emissions Standards for Model Years 2027 and Later Light-Duty and Medium-Duty Vehicles,Rule,Environmental Protection Agency,"Under the Clean Air Act, the Environmental Protection Agency (EPA) is establishing new, more protective emissions standards for criteria pollutants and greenhouse gases (GHG) for light-duty vehicles and Class 2b and 3 (""medium-duty"") vehicles that will phase-in over model years 2027 through 2032. In addition, EPA is finalizing GHG program revisions in several areas, including off-cycle and air conditioning credits, the treatment of upstream emissions associated with zero-emission vehicles and plug-in hybrid electric vehicles in compliance calculations, medium-duty vehicle incentive multipliers, and vehicle certification and compliance. EPA is also establishing new standards to control refueling emissions from incomplete medium-duty vehicles, and battery durability and warranty requirements for light- duty and medium-duty electric and plug-in hybrid electric vehicles. EPA is also finalizing minor amendments to update program requirements related to aftermarket fuel conversions, importing vehicles and engines, evaporative emission test procedures, and test fuel specifications for measuring fuel economy.",89 FR 27842, 2024-06214,https://www.federalregister.gov/documents/2024/04/18/2024-06214/multi-pollutant-emissions-standards-for-model-years-2027-and-later-light-duty-and-medium-duty,https://www.govinfo.gov/content/pkg/FR-2024-04-18/pdf/2024-06214.pdf,04/18/2024
Effluent Limitations Guidelines and Standards for the Construction and Development Point Source Category,Rule,Environmental Protection Agency,"The Environmental Protection Agency (EPA) is finalizing changes to the effluent limitations guidelines and standards for the Construction and Development point source category. EPA is promulgating these changes pursuant to a settlement agreement to resolve litigation. This final rule withdraws the numeric discharge standards, which are currently stayed, and changes several of the non-numeric provisions of the existing rule.",79 FR 12661, 2014-04612,https://www.federalregister.gov/documents/2014/03/06/2014-04612/effluent-limitations-guidelines-and-standards-for-the-construction-and-development-point-source,https://www.govinfo.gov/content/pkg/FR-2014-03-06/pdf/2014-04612.pdf,03/06/2014
Draft National Pollutant Discharge Elimination System (NPDES) General Permit for Stormwater Discharges From Construction Activities,Notice,Environmental Protection Agency,"All 10 EPA Regions are proposing for public comment on the draft 2017 National Pollutant Discharge Elimination System (NPDES) general permit for stormwater discharges from construction activities, also referred to as the ""2017 Construction General Permit (CGP)"" or the ""draft permit."" The draft permit, once finalized, will replace the existing general permit covering stormwater discharges from construction activities that will expire on February 16, 2017. EPA proposes to issue this permit for five (5) years, and to provide permit coverage to eligible operators in all areas of the country where EPA is the NPDES permitting authority, including Idaho, Massachusetts, New Hampshire, and New Mexico, Indian country lands, Puerto Rico, the District of Columbia, and most U.S. territories and protectorates. EPA seeks comment on the draft permit and on the accompanying fact sheet, which contains supporting documentation. This Federal Register document describes the draft permit in general and also includes specific topics on which the Agency is particularly seeking comment. EPA encourages the public to read the fact sheet to better understand the draft permit. The fact sheet and draft permit can be found at https://www.epa.gov/npdes/stormwater-discharges- construction-activities.",81 FR 21328, 2016-08276,https://www.federalregister.gov/documents/2016/04/11/2016-08276/draft-national-pollutant-discharge-elimination-system-npdes-general-permit-for-stormwater-discharges,https://www.govinfo.gov/content/pkg/FR-2016-04-11/pdf/2016-08276.pdf,04/11/2016
